"ballet_master","country_of_citizenship","employer","birth_year","gender","education","teacher","student","combined_student_teacher","award","num_awards","num_countries","num_influences","num_employer","num_education"
"Çimnaz Babayeva","Azerbaijan; Russia","Azerbaijan State Academic Opera and Ballet Theater",1946,"female","Azerbaijan State Academic Opera and Ballet Theater; Baku Choreography Academy","","","","Honored Artist of the Azerbaijan SSR; People's Artiste of the Azerbaijan SSR; State Prize of the Azerbaijan SSR",3,2,0,1,2
"Éric Vu-An","France","",1964,"male","Paris Opera","","","","Officer of the Legion of Honour; Knight of the Legion of Honour; Officer of the National Order of Merit; Chevalier des Arts et des Lettres; Commandeur des Arts et des Lettres",5,1,0,0,1
"Éva Gaál","Hungary","",1930,"female","","Ferenc Nádasi","","Ferenc Nádasi","Franz Liszt Prize; Meritorius Artist of Hungary",2,1,1,0,0
"Ágoston Balogh","Hungary","",1929,"male","","","","","",0,1,0,0,0
"Aage Thordal-Christensen","Denmark","Royal Danish Ballet; Los Angeles Ballet",1965,"male","","","","","",0,1,0,2,0
"Achille Viscusi","Italy","",1869,"male","","","","","",0,1,0,0,0
"Adél Orosz","Hungary","",1938,"female","","","","","Great Artist of Hungary Award; Kossuth Prize; Franz Liszt Prize; SZOT prize; Meritorius Artist of Hungary; Master Artist of the Hungarian State Opera House",6,1,0,0,0
"Adam Glushkovsky","Russia","",1793,"male","Vaganova Academy of Russian Ballet","","","","",0,1,0,0,1
"Adam P. Gluškovskij","","",1793,"male","","","","","",0,0,0,0,0
"Adolf Gassert","","",1823,"male","","","","","",0,0,0,0,0
"Adolph Bolm","United States of America; Russia","",1884,"male","Vaganova Academy of Russian Ballet","","","","",0,2,0,0,1
"Agnes de Mille","United States of America","",1905,"female","University of California, Los Angeles; California State University, Long Beach","","","","Tony Award for Best Choreography; Kennedy Center Honors; National Medal of Arts; Drama Desk Special Award; Capezio Dance Award; Elizabeth Blackwell Award",6,1,0,0,2
"Agrippina Vaganova","Russia","",1879,"female","Vaganova Academy of Russian Ballet","Nina Fedorovna Mlodzinskaya","Galina Ulanova; Marina Semyonova; Varvara P. Mey; Gelu Barbu; Q105960387","Nina Fedorovna Mlodzinskaya; Galina Ulanova; Marina Semyonova; Varvara P. Mey; Gelu Barbu; Q105960387","Stalin Prize; People's Artist of the RSFSR; Order of the Red Banner of Labour; Medal ""For Valiant Labour in the Great Patriotic War 1941–1945""",4,1,6,0,1
"Aiko Ōtaki","Japan","",1928,"female","","Eliana Pavlova; Masahide Komaki; Nadezhda Pavlova","","Eliana Pavlova; Masahide Komaki; Nadezhda Pavlova","",0,1,3,0,0
"Akiko Tachibana","Japan","",1907,"female","Utsunomiya University","Eliana Pavlova","Yoko Morishita; Noriko Ōhara; Katsuko Okamoto; Asami Maki; Yuriko Kawaguchi","Eliana Pavlova; Yoko Morishita; Noriko Ōhara; Katsuko Okamoto; Asami Maki; Yuriko Kawaguchi","Medal with Purple Ribbon",1,1,6,0,1
"Akim Cemilev","Ukraine; Russia","Crimean Tatar academic music and drama theater",1918,"male","","",""," ","Order of the Red Star; Medal ""For Battle Merit""; Medal ""For Courage""; Honored Art Worker of Ukraine; Order of the Patriotic War 2nd class",5,2,1,1,0
"Alain Bernard","Switzerland","",1932,"male","","","","","",0,1,0,0,0
"Albert","France","Paris Opera",1787,"male","","","","","",0,1,0,1,0
"Albert Aveline","France","",1883,"male","","","","","",0,1,0,0,0
"Alberto Alonso","Cuba","",1917,"male","","","","","",0,1,0,0,0
"Alejandro Parente","Argentina","Teatro Colón",1972,"male","Instituto Superior de Arte del Teatro Colón (Buenos Aires, Argentina)","","","","",0,1,0,1,1
"Aleksander Prokofiev","Russia","Moscow State Academy of Choreography",1942,"male","Russian Institute of Theatre Arts","","","","",0,1,0,1,1
"Aleksandr Aleksandrov","Russia","Bolshoi Theatre",1891,"male","Faculty of Law, Saint Petersburg State University","","","","",0,1,0,1,1
"Aleksandr Aleksandrovich Lapauri","Russia","Russian Institute of Theatre Arts",1926,"male","higher education; Russian Institute of Theatre Arts","Rostislav Zakharov","","Rostislav Zakharov","Merited Artist of the RSFSR; Order of the Badge of Honour; Medal ""For Distinguished Labour""",3,1,1,1,2
"Aleksandr Gil","Russia","",1943,"male","","","","","Merited Artist of the RSFSR",1,1,0,0,0
"Aleksandr Ivanovich Chekrygin","Russia","",1884,"male","Vaganova Academy of Russian Ballet","","","","Merited Artist of the RSFSR; Order of the Red Banner of Labour; Honored art worker of the Russian Soviet Federative Socialist Republic",3,1,0,0,1
"Aleksandr Radunsky","Russia","Bolshoi Theatre",1912,"male","","","","","Order of the Red Banner of Labour; Order of the Badge of Honour; Honored art worker of the Russian Soviet Federative Socialist Republic",3,1,0,1,0
"Aleksandr Rumnev","Russia","",1899,"male","","","","","",0,1,0,0,0
"Aleksandr Shiryaev","Russia","",1867,"male","Vaganova Academy of Russian Ballet","","","","Merited Artist of the RSFSR; Order of the Red Banner of Labour",2,1,0,0,1
"Aleksandra Fokina","United States of America; Russia","",1884,"female","","","","","",0,2,0,0,0
"Aleksandrs Lembergs","Latvia; Russia","",1921,"male","","","","","People's Artist of the USSR",1,2,0,0,0
"Aleksey Andreyev","Russia","Chuvash State Opera and Ballet Theater; Mariinsky Theatre; Bolshoi Theatre of Belarus",1920,"male","Vaganova Academy of Russian Ballet","","","","Merited Artist of the RSFSR; Honored Artist of the Byelorussian SSR",2,1,0,3,1
"Aleksey Yermolayev","Russia","Bolshoi Theatre of Belarus",1910,"male","Vaganova Academy of Russian Ballet","","Q111653564","Q111653564","Merited Artist of the RSFSR; People's Artist of the RSFSR; People's Artist of the USSR; Order of the Red Banner of Labour; Order of the Badge of Honour; Medal ""For Valiant Labour in the Great Patriotic War 1941–1945""; Stalin Prize; People's Artist of Byelorussian SSR",8,1,1,1,1
"Aleksi Chichinadze","Russia","",1917,"male","Russian Institute of Theatre Arts","","","","People's Artist of the RSFSR",1,1,0,0,1
"Alexander Alexeyevich Gorsky","Russia","",1871,"male","","","","","Q4187925",1,1,0,0,0
"Alexander Gontard","","",1706,"male","","","","","",0,0,0,0,0
"Alexander Ivanovich Pushkin","Russia","Mariinsky Theatre; Vaganova Academy of Russian Ballet",1907,"male","Vaganova Academy of Russian Ballet","","Rudolf Nureyev; Mikhail Baryshnikov; Xələf Safullin; Fauzi Sattarov","Rudolf Nureyev; Mikhail Baryshnikov; Xələf Safullin; Fauzi Sattarov","Honored art worker of the Russian Soviet Federative Socialist Republic",1,1,4,2,1
"Alexander Plisetski","Russia","",1931,"male","Moscow State Academy of Choreography","","","","",0,1,0,0,1
"Alexander Saxelin","Finland","",1899,"male","Vaganova Academy of Russian Ballet","","","","Pro Finlandia Medal of the Order of the Lion of Finland",1,1,0,0,1
"Alexander Vetrov","Russia","",1961,"male","","","","","People's Artist of the Russian Federation; Merited Artist of the RSFSR",2,1,0,0,0
"Alexandra Denisova","Canada; United States of America","Original Ballet Russe",1922,"female","","June Roper","","June Roper","",0,2,1,1,0
"Alexei Ratmansky","United States of America; Russia; Ukraine","National Opera of Ukraine",1968,"male","Russian Institute of Theatre Arts; Moscow State Academy of Choreography","","","","MacArthur Fellows Program; Merited Artist of Ukraine; National Dance Awards",3,3,0,1,2
"Alexis Blache","France","Bolshoi Kamenny Theatre",1791,"male","","","","","",0,1,0,1,0
"Alfons Heinrich Klahs","","",1832,"male","","","","","",0,0,0,0,0
"Alice Kaluza","Germany","",1920,"female","","","","","Cross of the Order of Merit of the Federal Republic of Germany",1,1,0,0,0
"Alicia Alonso","Cuba","",1920,"female","School of American Ballet","","","","Order of Merit of Duarte, Sanchez and Mella; Order of the Aztec Eagle; prima ballerina assoluta; Ordre des Arts et des Lettres; Order of Isabella the Catholic; Order of José Martí; Order of Vasco Núñez de Balboa; National Order of Merit Carlos Manuel de Cespedes; Officer of the Legion of Honour; Commandeur des Arts et des Lettres; Commander of the Order of Isabella the Catholic; honorary doctorate of the Polytechnic University of Valencia",12,1,0,0,1
"Alirza Sachar Zarif","","",NA,"male","","","","","",0,0,0,0,0
"Alla Dzgoeva","Russia","",1939,"female","","","","","Merited Artist of the RSFSR; Medal ""Veteran of Labour""; Jubilee Medal ""In Commemoration of the 100th Anniversary of the Birth of Vladimir Ilyich Lenin""",3,1,0,0,0
"Alla Michaylovna Sigalova","Russia","",1959,"female","Vaganova Academy of Russian Ballet; Russian Institute of Theatre Arts","","","","Merited Artist of the Russian Federation; Order of Friendship; Golden Mask; Honored art worker of the Russian Federation; Russian Federation's Government Award",5,1,0,0,2
"Alla Shelest","Russia","Vaganova Academy of Russian Ballet",1919,"female","Vaganova Academy of Russian Ballet","","","","People's Artist of the RSFSR; Medal ""For Valiant Labour in the Great Patriotic War 1941–1945""; Stalin Prize",3,1,0,1,1
"Amina Dilbazi","Azerbaijan; Russia","",1919,"female","","","","","Istiglal Order; Honored Artist of the Azerbaijan SSR; People's Artiste of the Azerbaijan SSR; Order of Friendship of Peoples; Order of the Badge of Honour",5,2,0,0,0
"Anatoli Berdychev","Russia","Novosibirsk Opera and Ballet Theatre",1947,"male","","","","","Merited Artist of the RSFSR; People's Artist of the RSFSR; Lenin Komsomol Prize",3,1,0,1,0
"Anatoly Fedorovich Shekera","Ukraine; Russia","National Opera of Ukraine",1935,"male","","Rostislav Zakharov","","Rostislav Zakharov","People's Artist of Ukraine; People's Artist of the Ukrainian SSR",2,2,1,1,0
"Anders Selinder","Sweden","",1806,"male","","","","","",0,1,0,0,0
"Andreas Pavley","","",1886,"male","","Enrico Cecchetti; Ivan Clustine","","Enrico Cecchetti; Ivan Clustine","",0,0,2,0,0
"Andrei Kuznetsov-Vecheslov","Russia","",1951,"male","Vaganova Academy of Russian Ballet","","","","",0,1,0,0,1
"Andrey Klemm","","",1967,"male","","","","","",0,0,0,0,0
"Andrey Petrov","Russia","",1945,"male","Russian Institute of Theatre Arts","","","","People's Artist of the RSFSR; Order of Friendship; Zhukov Medal; Order of Honour; Medal ""For Distinguished Labour""; Order ""For Merit to the Fatherland"", 4th class; Order of Holy Prince Daniel of Moscow 3rd class",7,1,0,0,1
"Andrey Rumyantsev","","Latvian National Opera and Ballet",1962,"male","","","","","",0,0,0,1,0
"Andris Liepa","Russia; Latvia","",1962,"male","Moscow State Academy of Choreography","","","","Merited Artist of the RSFSR; Order of the Three Stars; People's Artist of the Russian Federation; Order of Honour",4,2,0,0,1
"Aneta Voleská","Czech Republic","",1947,"female","","","","","Meritorious Artist",1,1,0,0,0
"Angelin Preljocaj","France","",1957,"male","","Merce Cunningham","","Merce Cunningham","Bessie Award; Knight of the Legion of Honour; Officer of the National Order of Merit; Officer of Arts and Letters",4,1,1,0,0
"Anne Teresa De Keersmaeker","Belgium","",1960,"female","Mudra International; New York University Tisch School of the Arts","Lilian Lambert; Fernand Schirren","","Lilian Lambert; Fernand Schirren","Bessie Award; Eugène Baie Award; Commandeur des Arts et des Lettres; Grand Decoration of Honour in Gold for services to the State of Vienna; honorary doctorate of the Vrije Universiteit Brussel; Brusseleir van’t joêr; Bronze Zinneke; Flemish Culture Award for General Cultural Achievement",8,1,2,0,2
"Antal Fodor","Hungary","",1941,"male","University of Theatre and Film Arts; Hungarian Dance Academy","","","","Great Artist of Hungary Award; Knight's Crosses of the Order of Merit of the Republic of Hungary; Officer's Cross of the Hungarian Order of Merit; Ferenc Erkel Prize",4,1,0,0,2
"Anthony Taylor","","",1944,"male","","","","","",0,0,0,0,0
"Antoine Bandieri de Laval","France","",1688,"male","","","","","",0,1,0,0,0
"Antoine Titus","France","Bolshoi Kamenny Theatre",1780,"male","","","","","",0,1,0,1,0
"Antoni Biosca","Spain","",1801,"male","","","","","",0,1,0,0,0
"Antonio Como","Denmark","Royal Danish Theatre",1750,"male","","","","","",0,1,0,1,0
"Antonio Gades","Spain","",1936,"male","","","","","Saint George's Cross; Order of José Martí; Gold Medal of Merit in the Fine Arts; National Dance Award",4,1,0,0,0
"Antonio Truyol","Argentina","Teatro Argentino de La Plata; Colon Theater Ballet",1930,"male","","","","","Konex Award; Outstanding Citizen of Buenos Aires",2,1,0,2,0
"Antony Tudor","United Kingdom","University of California, Irvine",1908,"male","","Marie Rambert","","Marie Rambert","Kennedy Center Honors; Queen Elizabeth II Coronation Award; Capezio Dance Award",3,1,1,1,0
"Arkady Obrant","Russia","Saint Petersburg City Palace of Youth Creativity",1906,"male","Lesgaft National State University of Physical Education, Sport and Health","","","","Medal ""For the Defence of Leningrad""; Medal ""For Battle Merit""; Order of the Patriotic War 1st class",3,1,0,1,1
"Arman Julhakyan","Armenia","",1979,"male","Yerevan State Institute of Theatre and Cinematography","","","","",0,1,0,0,1
"Armin Wild","","",1940,"male","","","","","",0,0,0,0,0
"Artem Shoshyn","Ukraine","Kyiv Municipal Academic Opera and Ballet Theatre for Children and Youth",1991,"male","Lesya Ukrainka Volyn National University","","","","Merited Artist of Ukraine",1,1,0,1,1
"Arthur Saint-Léon","France","",1821,"male","","","","","",0,1,0,0,0
"Arthur Sprankel","","",1908,"male","","","","","",0,0,0,0,0
"Asaf Messerer","Russia","Russian Institute of Theatre Arts",1903,"male","","","","","Merited Artist of the RSFSR; People's Artist of the RSFSR; People's Artist of the USSR; Order of the Red Banner of Labour; Order of Friendship of Peoples; Stalin Prize",6,1,0,1,0
"Asami Maki","Japan","Q11570631; National Ballet of Japan",1934,"female","","Alexandra Danilova; Akiko Tachibana","Noriko Ōhara; Yoshie Narisawa; Yukiko Itō","Alexandra Danilova; Akiko Tachibana; Noriko Ōhara; Yoshie Narisawa; Yukiko Itō","Order of Culture; Person of Cultural Merit",2,1,5,2,0
"Askold Makarov","Russia","Saint Petersburg Conservatory",1925,"male","Vaganova Academy of Russian Ballet; Russian Institute of Theatre Arts","","","","Merited Artist of the RSFSR; People's Artist of the RSFSR; People's Artist of the USSR; Medal ""Veteran of Labour""; Order of Friendship; Order of Honour; Stalin Prize",7,1,0,1,2
"Attila Egerházi","Hungary","",1964,"male","","","","","Q1033811",1,1,0,0,0
"Attilio Labis","France","",1936,"male","","","","","",0,1,0,0,0
"August Bournonville","Denmark; France","",1805,"male","","Auguste Vestris; Pierre Gardel; Antoine Bournonville","Joseph Hansen; Christian Johansson","Auguste Vestris; Pierre Gardel; Antoine Bournonville; Joseph Hansen; Christian Johansson","",0,2,5,0,0
"August Linder","Germany","",1859,"male","","","","","",0,1,0,0,0
"Augustin Berger","Czech Republic","",1861,"male","","","","","",0,1,0,0,0
"Aurélie Dupont","France","",1973,"female","Paris Opera Ballet School","Patrice Bart; Laurent Hilaire; Claude Bessy; Gilbert Mayer","","Patrice Bart; Laurent Hilaire; Claude Bessy; Gilbert Mayer","Prix Carpeaux; Knight of the Legion of Honour; Chevalier des Arts et des Lettres",3,1,4,0,1
"Ayana Shinzhina","Russia","",1969,"female","","","","","Merited Artist of the Russian Federation",1,1,0,0,0
"Aysulu Tokombayeva","Russia; Kyrgyzstan","Kyrgyz Opera and Ballet Theatre; Hacettepe University Ankara State Conservatory",1947,"female","Vaganova Academy of Russian Ballet","Nina Belikova","","Nina Belikova","People's Artist of the USSR; USSR State Prize",2,2,1,2,1
"Ğali Abaydulov","Russia","",1953,"male","Vaganova Academy of Russian Ballet; Russian Institute of Theatre Arts","","","","Golden Mask; Vasilyev Brothers State Prize of the RSFSR",2,1,0,0,2
"Azari Plisetski","Switzerland; Russia","",1937,"male","Russian Institute of Theatre Arts; Moscow State Academy of Choreography","","","","Merited Artist of the RSFSR; Order of Friendship",2,2,0,0,2
"Azat Gharibyan","Russia","Armenian State Pedagogical University; Yerevan Opera Theater; Armenian Ensemble of Song and Dance after Tatul Altounian; Yerevan Dancing Art State College",1923,"male","Vaganova Academy of Russian Ballet; Yerevan Dancing Art State College","","","","Honored Artist of the Armenian SSR; People's Artist of the Armenian SSR",2,1,0,4,2
"Bétina Marcolin","France","Royal Swedish Opera; Theater Confidencen",1965,"female","","","","","",0,1,0,2,0
"Barthélémy de Montagut","France","",1505,"male","","","","","",0,1,0,0,0
"Basil Thompson","","",1937,"male","","","","","",0,0,0,0,0
"Belén Lobo","Venezuela","",1932,"female","","","","","",0,1,0,0,0
"Benjamin Millepied","France","",1977,"male","Conservatoire national supérieur de musique et de danse de Lyon; School of American Ballet","","","","Officer of Arts and Letters",1,1,0,0,2
"Bernara Karieva","Uzbekistan; Russia","Navoi Theater",1936,"female","","","","","People's Artist of the USSR; Order of the Red Banner of Labour; USSR State Prize; Order of the Badge of Honour; Medal ""For Distinguished Labour""; Order of Friendship; People's Artist of the Uzbek SSR; Shukhrat medal; Certificate of Honor of the Republic of Uzbekistan; Q25523638; State Prize of the Uzbek SSR Named After Hamza",11,2,0,1,0
"Birgit Cullberg","Sweden","Royal Swedish Opera; Stockholm City Theatre",1908,"female","The Royal Ballet","Kurt Jooss","","Kurt Jooss","Litteris et Artibus; honorary member; Professor; Swedish Academy's Theatre Award; Commandeur des Arts et des Lettres",5,1,1,2,1
"Boris Akimov","Russia","Russian Institute of Theatre Arts",1946,"male","Russian Institute of Theatre Arts","","","","Merited Artist of the RSFSR; People's Artist of the RSFSR; People's Artist of the USSR; USSR State Prize; Order of Friendship; Order of the Rising Sun; Order of the Badge of Honour; Order of Honour; Lenin Komsomol Prize",9,1,0,1,1
"Boris Danilov","Russia","",1929,"male","","","","","Merited Artist of the RSFSR; People's Artist of the RSFSR; Order of Honour",3,1,0,0,0
"Boris Eifman","Russia","",1946,"male","Saint Petersburg Conservatory","","","","Order of Merit of the Republic of Poland; Golden Mask; People's Artist of the Russian Federation; Order of the Badge of Honour; Order of Honour; State Prize of the Russian Federation; Honoured Worker of Kazakhstan; honorary citizen of Saint Petersburg; Russian Federation's Government Award; Honored art worker of the Russian Soviet Federative Socialist Republic; Chevalier des Arts et des Lettres; Commandeur des Arts et des Lettres; Order ""For Merit to the Fatherland"", 4th class; Order ""For Merit to the Fatherland"", 3rd class; Order ""For Merit to the Fatherland"", 2nd class; Order ""For Merit to the Fatherland"", 1st class; Government Prize in Culture",17,1,0,0,1
"Boris Fenster","Russia","Saint Petersburg Conservatory",1916,"male","Vaganova Academy of Russian Ballet","","","","People's Artist of the RSFSR; Medal ""For Valiant Labour in the Great Patriotic War 1941–1945""; Medal ""In Commemoration of the 250th Anniversary of Leningrad""; Honored art worker of the Russian Soviet Federative Socialist Republic; Stalin Prize, 2nd degree",5,1,0,1,1
"Boris Moiseev","Russia","Kharkiv National Academic Opera and Ballet Theatre M. V. Lysenka; Lithuanian Symphonic Wind Orchestra",1954,"male","Q24071259","","","","Merited Artist of the Russian Federation; Golden Gramophone Award",2,1,0,2,1
"Boris Myagkov","Russia","Bolshoi Theatre; Mosconcert",1941,"male","Moscow State Academy of Choreography","","","","N.K. Krupskaya's state award",1,1,0,2,1
"Boris Sichkin","United States of America; Russia","",1922,"male","","","","","Medal ""For the Victory over Germany in the Great Patriotic War 1941–1945""; Medal ""For the Liberation of Warsaw""; Medal ""For the Capture of Berlin""; Medal ""For the Defence of Kyiv""; Medal ""For the Capture of Königsberg""; Medal ""For Battle Merit""; Medal ""For the Liberation of Prague""; Medal ""For the Defence of Stalingrad""",8,2,0,0,0
"Bronislava Nijinska","Poland; Russia","",1891,"female","Vaganova Academy of Russian Ballet","Enrico Cecchetti","","Enrico Cecchetti","",0,2,1,0,1
"Bulat Ayukhanov","Kazakhstan; Russia","",1938,"male","Vaganova Academy of Russian Ballet; Russian Institute of Theatre Arts","","","","Order of the Red Banner of Labour; Order of the Badge of Honour; People's Artist of Kazakh SSR",3,2,0,0,2
"Carl Edström","Sweden","",1837,"male","","","","","",0,1,0,0,0
"Carl Godlewski","Germany","",1862,"male","","","","","",0,1,0,0,0
"Carl Macco","","",NA,"male","","","","","",0,0,0,0,0
"Carl Raimund","","",1871,"male","","","","","",0,0,0,0,0
"Carl Tescher","","",1812,"male","","","","","",0,0,0,0,0
"Carl von Hacht","","",1905,"male","","","","","",0,0,0,0,0
"Carlo Blasis","Italy","",1797,"male","","Salvatore Viganò; Auguste Vestris; Pierre Gardel; Jean-Baptiste Blache","Carlotta Brianza; Giovanni Lepri","Salvatore Viganò; Auguste Vestris; Pierre Gardel; Jean-Baptiste Blache; Carlotta Brianza; Giovanni Lepri","",0,1,6,0,0
"Caspar Thoms","","",1803,"male","","","","","",0,0,0,0,0
"Charles Didelot","Sweden; France","Bolshoi Kamenny Theatre",1767,"male","","Louis Frossard","","Louis Frossard","",0,2,1,1,0
"Charles Le Picq","France","Paris Opera",1745,"male","","Jean-Georges Noverre","","Jean-Georges Noverre","",0,1,1,1,0
"Chris Allen Jensen","United States of America","",1952,"male","","","","","",0,1,0,0,0
"Christian Berner","Sweden","",1702,"male","","","","","",0,1,0,0,0
"Claude Balon","France","",1671,"male","","","","","",0,1,0,0,0
"Claude Newman","","",NA,"male","","","","","",0,0,0,0,0
"Csaba Sebestyén","Hungary","",1961,"male","University of Theatre and Film Arts; Hungarian Dance Academy","","","","Q1033811",1,1,0,0,2
"Csillag Pál","Hungary","",1971,"male","University of Theatre and Film Arts; Hungarian Dance Academy","","","","",0,1,0,0,2
"Dana Demkiv","Ukraine; Russia","",1932,"female","","","","","Honored Worker of Culture of Ukraine; anniversary medal for the 20 years of independence of Ukraine; Order of Princess Olga, 3rd class",3,2,0,0,0
"Danila Korsuntsev","Russia","",1973,"male","","","","","Merited Artist of the Russian Federation",1,1,0,0,0
"Darci Kistler","United States of America","",1964,"female","School of American Ballet; Professional Children's School","","","","Capezio Dance Award",1,1,0,0,2
"David Lichine","France; Russia","Ballet Russe de Monte Carlo",1910,"male","","","","","",0,2,0,1,0
"Desmond Doyle","South Africa","",1932,"male","","","","","",0,1,0,0,0
"Dimitrije Parlic","","",1919,"male","","","","","",0,0,0,0,0
"Dmitry Bryantsev","Russia","",1947,"male","Vaganova Academy of Russian Ballet","","","","People's Artist of the RSFSR; Golden Mask; Honored art worker of the Russian Soviet Federative Socialist Republic; Order ""For Merit to the Fatherland"", 4th class",4,1,0,0,1
"Dmitry Klyavin","Ukraine; Russia","National Opera of Ukraine",1965,"male","Kyiv Choreographic School","","","","Merited Artist of Ukraine",1,2,0,1,1
"Dokku Maltsagov","Russia","",1950,"male","Gorsky State University of Agriculture","","","","Merited Artist of the RSFSR; People's Artist of the Russian Federation; Order of Friendship; Government Prize of the Russian Federation",4,1,0,0,1
"Dominic Antonucci","United States of America","",1974,"male","School of American Ballet","","","","",0,1,0,0,1
"Donald MacLeary","United Kingdom","",1937,"male","","","","","Officer of the Order of the British Empire",1,1,0,0,0
"Doris Laine","Finland","",1931,"female","","","","","Pro Finlandia Medal of the Order of the Lion of Finland",1,1,0,0,0
"Edvard Manukyan","Armenia; Russia","Yerevan Opera Theater; State Dance Ensemble of Armenia; Armenian Ensemble of Song and Dance after Tatul Altounian; Q21532506",1908,"male","","","","","People's Artist of the Armenian SSR",1,2,0,4,0
"Egbert Strolka","","",1935,"male","","","","","",0,0,0,0,0
"Eiji Kubo","Japan","",NA,"male","","","","","",0,1,0,0,0
"Ekaterina Maximova","Russia","Bolshoi Theatre",1939,"female","Russian Institute of Theatre Arts","","","","Merited Artist of the RSFSR; People's Artist of the RSFSR; Order of Lenin; People's Artist of the USSR; Order of the Red Banner of Labour; Order of Friendship of Peoples; USSR State Prize; The Crystal Turandot; Order of Rio Branco; Glinka State Prize of the RSFSR; Vasilyev Brothers State Prize of the RSFSR; Russian Federation Government Certificate of Honour; Lenin Komsomol Prize; Order ""For Merit to the Fatherland"", 4th class; Order ""For Merit to the Fatherland"", 3rd class; Russian Federation Presidential Certificate of Gratitude",16,1,0,1,1
"Elena Poliakova","","",1884,"female","","","","","",0,0,0,0,0
"Eliana Pavlova","Japan; Russia","",1897,"female","","","Aiko Ōtaki; Hiroshi Shimada; Chieko Hattori; Yūsaku Azuma; Akiko Tachibana; Yaoko Kaitani; Reiko Kondō; Mikio Maki","Aiko Ōtaki; Hiroshi Shimada; Chieko Hattori; Yūsaku Azuma; Akiko Tachibana; Yaoko Kaitani; Reiko Kondō; Mikio Maki","",0,2,8,0,0
"Elsa Maria Sylvestersson","Finland","",1924,"female","","","","","Pro Finlandia Medal of the Order of the Lion of Finland",1,1,0,0,0
"Emil Graeb","","",NA,"male","","","","","",0,0,0,0,0
"Enrico Cecchetti","Italy","La Scala",1850,"male","","Filippo Taglioni; Giovanni Lepri","Bronislava Nijinska; Lyubov Egorova; Natalia Tagliori","Filippo Taglioni; Giovanni Lepri; Bronislava Nijinska; Lyubov Egorova; Natalia Tagliori","",0,1,5,1,0
"Enrique Lommi","Argentina","Berlin State Ballet; Colon Theater Ballet",1922,"male","","Léonide Massine; Serge Lifar","","Léonide Massine; Serge Lifar","Konex Award",1,1,2,2,0
"Erik Bruhn","Denmark","",1928,"male","The Royal Danish Ballet School","","","","Nijinsky Award; Litteris et Artibus; Teaterpokalen; Knight of the Order of the Dannebrog",4,1,0,0,1
"Erkin Mademilova","Kyrgyzstan; Russia","",1929,"female","","","","","Order of the Badge of Honour; Medal ""For Valiant Labour in the Great Patriotic War 1941–1945""; Medal ""For Distinguished Labour""; Friendship Medal; Q4313308",5,2,0,0,0
