"ballet_master","country_of_citizenship","employer","birth_year","gender","education","teacher","student","combined_student_teacher","award","num_awards","num_countries","num_influences","num_employer","num_education"
"Leonid Lavrovsky","Russia","Russian Institute of Theatre Arts",1905,"male","Vaganova Academy of Russian Ballet","","Duska Sifnios","Duska Sifnios","Merited Artist of the RSFSR; People's Artist of the RSFSR; Order of Lenin; People's Artist of the USSR; Order of the Red Banner of Labour; Order of the Badge of Honour; Medal ""For Valiant Labour in the Great Patriotic War 1941–1945""; Stalin Prize",8,1,1,1,1
"Leonid Lebedev","Russia","",1943,"male","","","","","",0,1,0,0,0
"Leonid Leontyev","","",1885,"male","Vaganova Academy of Russian Ballet","","","","Merited Artist of the RSFSR",1,0,0,0,1
"Leonid Milovanov","Russia","",1949,"male","","","","","Merited Artist of the Russian Federation; People's Artist of the Russian Federation; Government Prize in Culture; Order For Merit in Culture and Art",4,1,0,0,0
"Leonid Sychyov","Russia","",1968,"male","","","","","Merited Artist of the Russian Federation",1,1,0,0,0
"Leonid Yakobson","Russia","",1904,"male","Vaganova Academy of Russian Ballet","","","","Medal ""For Valiant Labour in the Great Patriotic War 1941–1945""; Medal ""In Commemoration of the 250th Anniversary of Leningrad""; Stalin Prize; Honored art worker of the Russian Soviet Federative Socialist Republic",4,1,0,0,1
"Leopold Dubois","Austria","",1876,"male","","","","","",0,1,0,0,0
"Lev Asaulyak","","Perm Opera and Ballet Theatre",1935,"male","","","","","Merited Artist of the RSFSR",1,0,0,1,0
"Lev Ivanov","Russia","",1834,"male","","Jean-Antoine Petipa; Pierre Frédéric Malevergne","Ekaterina Vazem","Jean-Antoine Petipa; Pierre Frédéric Malevergne; Ekaterina Vazem","",0,1,3,0,0
"Leyla Vakilova","Azerbaijan; Russia","",1927,"female","","Gamar Almaszadeh","Afag Malikova","Gamar Almaszadeh; Afag Malikova","Order of Lenin; People's Artist of the USSR; Shohrat Order; Honored Artist of the Azerbaijan SSR; People's Artiste of the Azerbaijan SSR; Honorary decree of the Presidium of the Supreme Soviet of the Azerbaijan SSR",6,2,2,0,0
"Lidia Chernysheva","Russia","",1912,"female","","","","","Order of Lenin; Medal ""For the Liberation of Prague""; Medal ""For the Victory over Germany in the Great Patriotic War 1941–1945""; People's Artist of the USSR; Order of the Red Banner of Labour; Order of Friendship of Peoples; Order of the Red Star; Order of the Badge of Honour; People's Artist of Kazakh SSR; Order of the Patriotic War 2nd class",10,1,0,0,0
"Lidia Segni","Argentina","",1944,"female","","","","","",0,1,0,0,0
"Lidiya Ustinova","Russia","Stanislavski and Nemirovich-Danchenko Moscow Academic Music Theatre",1937,"female","","","","","Merited Artist of the Russian Federation; People's Artist of the Russian Federation",2,1,0,1,0
"Lieselotte Sauerbaum","Germany","Q1545800",1921,"female","","","","","",0,1,0,1,0
"Lilian Karina Vásárhelyi","Hungary; Sweden; Russia","",1907,"female","","","","","",0,3,0,0,0
"Loipa Araújo","Cuba","Ballet National de Marseille; Cuban National Ballet",1941,"female","Cuban National Ballet School","","","","Legion of Honour",1,1,0,2,1
"Louis Duport","France","Paris Opera",1781,"male","","Jean-François Coulon","","Jean-François Coulon","",0,1,1,1,0
"Louis Dupré","France","",NA,"male","","","Maximilien Gardel; Jean-Baptiste Hus","Maximilien Gardel; Jean-Baptiste Hus","",0,1,2,0,0
"Louis Henry","France","",1784,"male","","Jean-François Coulon","","Jean-François Coulon","",0,1,1,0,0
"Louis Lestang","France","Paris Opera",1601,"male","","","","","",0,1,0,1,0
"Louis Milon","France","Paris Opera",1766,"male","","","","","",0,1,0,1,0
"Louise Marquet","France","",1834,"female","","","","","",0,1,0,0,0
"Louis-Guillaume Pécour","France","",1653,"male","","Pierre Beauchamp","","Pierre Beauchamp","",0,1,1,0,0
"Lubov Tchernicheva","Russia","",1890,"female","","","","","Queen Elizabeth II Coronation Award",1,1,0,0,0
"Lucien Petipa","France","The Mint",1815,"male","Royal Conservatory of Brussels","Jean-Antoine Petipa","Louis Mérante; Laure Fonta","Jean-Antoine Petipa; Louis Mérante; Laure Fonta","",0,1,3,1,1
"Lucy Igaz","Hungary","",1924,"female","","","","","",0,1,0,0,0
"Ludmila Semenyaka","Russia","",1952,"female","Vaganova Academy of Russian Ballet","Nina Belikova","","Nina Belikova","Merited Artist of the RSFSR; People's Artist of the RSFSR; People's Artist of the USSR; USSR State Prize; Order of Honour; Lenin Komsomol Prize",6,1,1,0,1
"Ludmila Voskresenskaya","","",1930,"female","Russian Institute of Theatre Arts; Q86676557","","","","Merited Artist of the RSFSR",1,0,0,0,2
"Luigi Bonino","Italy","",1949,"male","","","","","",0,1,0,0,0
"Luis Aguilar","Spain; Cuba","",1949,"male","University of Havana; Escuela Nacional de Arte","","","","",0,2,0,0,2
"Lydia Kyasht","United Kingdom; Russia","Mariinsky Theatre; Empire Leicester Square",1885,"female","","","","","",0,2,0,2,0
"Lydia Redega","","",1888,"female","","","","","",0,0,0,0,0
"Lyubov Egorova","France; Russia","",1880,"female","Vaganova Academy of Russian Ballet","Enrico Cecchetti; Ekaterina Vazem; Anna Johansson","Maurice Béjart; Sonia Gaskell; Solange Schwarz","Enrico Cecchetti; Ekaterina Vazem; Anna Johansson; Maurice Béjart; Sonia Gaskell; Solange Schwarz","",0,2,6,0,1
"Lyudmila Alekseyeva","Russia","",1890,"female","Guerrier Courses","","","","",0,1,0,0,1
"Lyudmila Sakharova","Russia","Perm Opera and Ballet Theatre",1926,"female","Perm State Humanitarian Pedagogical University","","Lyubov Fominykh","Lyubov Fominykh","People's Artist of the RSFSR; People's Artist of the USSR; Order of the Red Banner of Labour; Order of Friendship of Peoples; Order ""For Merit to the Fatherland"", 4th class",5,1,1,1,1
"Máša Cvejičová","","",1901,"female","","","","","",0,0,0,0,0
"Mária Lukács","","",1934,"female","","","","","",0,0,0,0,0
"Māris Liepa","Latvia; Russia","Latvian National Opera and Ballet",1936,"male","Russian Institute of Theatre Arts; Moscow State Academy of Choreography; Riga ballet school","","","","Merited Artist of the RSFSR; People's Artist of the RSFSR; Lenin Prize; People's Artist of the USSR; Order of Friendship of Peoples",5,2,0,1,3
"Madina Aliyeva","Azerbaijan; Russia","",1965,"female","Baku State University; Baku Choreography Academy","","","","People's Artiste of Azerbaijan; Honored Artist of the Republic of Azerbaijan",2,2,0,0,2
"Maguy Marin","France","",1951,"female","Toulouse Conservatory school; Mudra International","","","","Bessie Award; Q3114219",2,1,0,0,2
"Maj-Lis Rajala","Finland","",1930,"female","","","","","Pro Finlandia Medal of the Order of the Lion of Finland",1,1,0,0,0
"Makhmud Esambayev","Russia","",1924,"male","","","","","Merited Artist of the RSFSR; People's Artist of the RSFSR; Order of Lenin; Hero of Socialist Labour; People's Artist of the USSR; Order of the Red Banner of Labour; Order of Friendship of Peoples; Order of Friendship; Order ""For Merit to the Fatherland"", 3rd class; Order of the Patriotic War 2nd class",10,1,0,0,0
"Maksim Martirosyan","Armenia; Russia","Yerevan Opera Theater; Yerevan Dancing Art State College",1931,"male","Russian Institute of Theatre Arts; Moscow State Academy of Choreography; Yerevan Dancing Art State College","","","","Honored Art Worker of the Armenian SSR; People's Artist of the RSFSR; Order of St. Mesrop Mashtots; Honored Artist of the Armenian SSR; Khorenatsi medal; Second Class Service of the Fatherland Medal",6,2,0,2,3
"Maksym Bulhakov","Ukraine","",1982,"male","","","","","",0,1,0,0,0
"Maqsud Mammadov","Azerbaijan; Russia","Azerbaijan State Academic Opera and Ballet Theater",1929,"male","","","","","Order of the Red Banner of Labour; Shohrat Order; Honored Artist of the Azerbaijan SSR; People's Artiste of the Azerbaijan SSR; ""Theatre Worker"" gold medal",5,2,0,1,0
"María de Ávila","Spain","",1920,"female","","","","","Gold Medal of Merit in the Fine Arts; Grand Cross of the Civil Order of Alfonso X the Wise; Gold Medal of Work Merit",3,1,0,0,0
"Marcela Černačová","","",1940,"female","Taneční konzervatoř hlavního města Prahy","","","","",0,0,0,0,1
"Marcela Martiníková","","",1940,"female","Prague Conservatory; Taneční konzervatoř hlavního města Prahy","","","","",0,0,0,0,2
"Marcelle Vuillet-Baum","Hungary; Switzerland","",1905,"female","","","","","",0,2,0,0,0
"Marc-Emmanuel Zanoli","France","",1983,"male","","","","","",0,1,0,0,0
"Margaretha von Bahr","Finland","",1921,"female","","","","","Pro Finlandia Medal of the Order of the Lion of Finland; H. M. The King's Medal",2,1,0,0,0
"Maria Casentini","","",1778,"female","","","","","",0,0,0,0,0
"Marianna Sedova","Russia","",1946,"female","Moscow State Academy of Choreography","","","","",0,1,0,0,1
"Marie Šlezingrová","","",1949,"female","Taneční konzervatoř","","","","",0,0,0,0,1
"Marie Dobromilová","","",1892,"female","","","","","",0,0,0,0,0
"Marie Rambert","Poland; United Kingdom; Russia","",1888,"female","","Sergei Diaghilev; Émile Jaques-Dalcroze; Enrico Cecchetti","Audrey Hepburn","Sergei Diaghilev; Émile Jaques-Dalcroze; Enrico Cecchetti; Audrey Hepburn","Queen Elizabeth II Coronation Award; Dame Commander of the Order of the British Empire",2,3,4,0,0
"Marie Sallé","France","",1707,"female","","Françoise Prévost","","Françoise Prévost","",0,1,1,0,0
"Marie Svadlenova-Machova-Klimesova","Czech Republic","",1896,"female","","","","","",0,1,0,0,0
"Marina Kondratyeva","Russia","Russian Institute of Theatre Arts",1934,"female","Russian Institute of Theatre Arts","","","","Merited Artist of the RSFSR; People's Artist of the RSFSR; People's Artist of the USSR; Order of the Badge of Honour; Order of Honour",5,1,0,1,1
"Marius Petipa","Russia; France","Bolshoi Kamenny Theatre",1818,"male","Royal Conservatory of Brussels","","","","French Order of Academic Palms; Order of Saint Anna, 2nd class; Order of Saint Stanislaus, 3rd class; Order of St. Vladimir, 4th class; Order of the Crown",5,2,0,1,1
"Martha Graham","United States of America","New York University",1894,"female","Denishawn School of Dancing and Related Arts; Santa Barbara High School","Ruth St. Denis; Ted Shawn","Yvonne Rainer; Anne-Marie Reynaud; Bessie Schonberg; Bill Smith","Ruth St. Denis; Ted Shawn; Yvonne Rainer; Anne-Marie Reynaud; Bessie Schonberg; Bill Smith","Presidential Medal of Freedom; Council of Fashion Designers of America; Guggenheim Fellowship; Kennedy Center Honors; National Medal of Arts; National Women's Hall of Fame; Laurel Leaf Award; Capezio Dance Award; honorary doctor of Harvard University; Fellow of the American Academy of Arts and Sciences; honorary doctor of Brandeis University",11,1,6,1,2
"Martin Tomsa","","",1968,"male","","","","","",0,0,0,0,0
"Masahide Komaki","Japan","",1911,"male","","","Aiko Ōtaki; Kiyoko Ishii","Aiko Ōtaki; Kiyoko Ishii","Medal with Purple Ribbon",1,1,2,0,0
"Mats Ek","Sweden","",1945,"male","","","","","Litteris et Artibus; Europe Theatre Prize; Swedish Academy's Theatre Award; Commandeur des Arts et des Lettres; Q100141088",5,1,0,0,0
"Matthew Bourne","United Kingdom","",1960,"male","Trinity Laban Conservatoire of Music and Dance","","","","Tony Award for Best Direction of a Musical; Tony Award for Best Choreography; BBC Jazz Awards; Knight Bachelor; Critics' Circle Award for Distinguished Service to the Arts; Drama Desk Award for Outstanding Choreography; Drama Desk Award for Outstanding Director of a Musical; Helpmann Award for Best Choreography in a Musical; Laurence Olivier Award for Best Theatre Choreographer; National Dance Awards; Queen Elizabeth II Coronation Award; Shakespeare Prize; Society of London Theatre Special Award; Officer of the Order of the British Empire",14,1,0,0,1
"Maurice Béjart","Switzerland; France","",1927,"male","Paris Opera Ballet School","Vera Volkova; Lyubov Egorova; Boris Knyazev; Léo Staats","Thales Pan Chacon; Achilleas Manolis","Vera Volkova; Lyubov Egorova; Boris Knyazev; Léo Staats; Thales Pan Chacon; Achilleas Manolis","Grand Officer of the Order of the Crown; Grand Officer of the Order of Prince Henry; Commandeur des Arts et des Lettres",3,2,6,0,1
"Max Terpis","Switzerland; Germany","",1889,"male","","","","","",0,2,0,0,0
"Maximilien Gardel","France","",1741,"male","","Louis Dupré","Pierre Gardel","Louis Dupré; Pierre Gardel","",0,1,2,0,0
"Maya Plisetskaya","Russia; Spain; Lithuania; Germany","",1925,"female","","","","","Commandeur des Arts et des Lettres; Order of the Rising Sun, 3rd class; Commander of the Order of Isabella the Catholic; Order ""For Merit to the Fatherland"", 4th class; Order ""For Merit to the Fatherland"", 3rd class; Order ""For Merit to the Fatherland"", 2nd class; Order ""For Merit to the Fatherland"", 1st class; Commander of the Order of Gediminas; Golden Medal for Merit to Culture; Barbara Radziwiłł medal; Princess of Asturias Award for the Arts; Gold Medal of Merit in the Fine Arts; Triumph; Officer of the Legion of Honour; Knight of the Legion of Honour; Chevalier des Arts et des Lettres; Praemium Imperiale; Princess of Asturias Awards; People's Artist of the USSR; Order of the Red Banner of Labour; Ordre des Arts et des Lettres; Order of the Rising Sun; Order of Isabella the Catholic; Golden Mask; Medal for Merit to Culture; Jubilee Medal ""In Commemoration of the 100th Anniversary of the Birth of Vladimir Ilyich Lenin""; Order of the Lion of Finland; Medal ""In Commemoration of the 850th Anniversary of Moscow""; Order of the Lithuanian Grand Duke Gediminas; Order for Merits to Lithuania; Merited Artist of the RSFSR; People's Artist of the RSFSR; Lenin Prize; Order of Lenin; Hero of Socialist Labour",35,4,0,0,0
"Menyhárt Jacqueline","France","",1937,"female","Eötvös Loránd University","","","","",0,1,0,0,1
"Merle Park","United Kingdom","",1937,"female","Royal Ballet School; Elmhurst Ballet School","","","","Queen Elizabeth II Coronation Award; Dame Commander of the Order of the British Empire",2,1,0,0,2
"Micha van Hoecke","Belgium","",1944,"male","","","","","",0,1,0,0,0
"Michaël Denard","France","",1944,"male","","","","","Knight of the Legion of Honour; Officer of the National Order of Merit; Officer of Arts and Letters",3,1,0,0,0
"Michel Blondy","France","",1675,"male","","Pierre Beauchamp","Marie Anne de Cupis de Camargo; Françoise Prévost; Franz Hilverding","Pierre Beauchamp; Marie Anne de Cupis de Camargo; Françoise Prévost; Franz Hilverding","",0,1,4,0,0
"Michel Fokine","United States of America; Russia","",1880,"male","Vaganova Academy of Russian Ballet","Platon Karsavin","","Platon Karsavin","French Order of Academic Palms",1,2,1,0,1
"Michel Paschoud de Lûtry","","",1923,"male","","","","","",0,0,0,0,0
"Miho Fujii","","",1980,"female","","","","","",0,0,0,0,0
"Mijaela Tesleoanu","Romania; Cuba","",1942,"female","","","","","",0,2,0,0,0
"Mika Nemoto","Japan","",1944,"female","Kanto Gakuin University","","Yasuyo Omoto","Yasuyo Omoto","",0,1,1,0,1
"Mikhail Baryshnikov","Latvia; Russia; United States of America","New York City Ballet; National Ballet of Canada; Baryshnikov Arts Center; White Oak Dance Project; Bolshoi Theatre; Mariinsky Theatre; American Ballet Theatre",1948,"male","Vaganova Academy of Russian Ballet; Riga Secondary School No. 22; Riga ballet school","","","","Emmy Award; Praemium Imperiale; Merited Artist of the RSFSR; Kennedy Center Honors; National Medal of Arts; Queen Elizabeth II Coronation Award; Theatre World Special Award; Vilcek Prize; Fellow of the American Academy of Arts and Sciences; Great Immigrants Award",10,3,0,7,3
"Mikhail Godenko","Russia","",1919,"male","Moscow State Academy of Choreography","","","","People's Artist of the RSFSR; Order of Lenin; Hero of Socialist Labour; Medal ""For the Victory over Germany in the Great Patriotic War 1941–1945""; People's Artist of the USSR; Order of the Red Banner of Labour; Medal ""For the Capture of Budapest""; USSR State Prize; Medal ""For the Capture of Vienna""; Medal ""For Battle Merit""; Honored art worker of the Russian Soviet Federative Socialist Republic; Order of the Patriotic War 2nd class",12,1,0,0,1
"Mikhail Kogan","Russia","",1946,"male","","","","","Honored art worker of the Russian Federation",1,1,0,0,0
"Mikhail Lavrovsky","Russia","",1941,"male","Russian Institute of Theatre Arts; Moscow State Academy of Choreography","Rostislav Zakharov","","Rostislav Zakharov","Merited Artist of the RSFSR; People's Artist of the RSFSR; Lenin Prize; People's Artist of the USSR; Order of the Red Banner of Labour; USSR State Prize; Order of Honour; Lenin Komsomol Prize; Order ""For Merit to the Fatherland"", 4th class",9,1,1,0,2
"Mikhail Markovich Gabovich","Russia","",1905,"male","","","","","People's Artist of the RSFSR; Order of the Red Banner of Labour; Order of the Badge of Honour; Stalin Prize",4,1,0,0,0
"Mikhail Messerer","United Kingdom; Russia","Mariinsky Theatre; Paris Opera; The Royal Ballet; American Ballet Theatre; National Theatre; Mikhaylovsky Theatre; Royal Danish Ballet; La Scala; Perm Opera and Ballet Theatre; Bolshoi Theatre",1948,"male","Russian Institute of Theatre Arts; Moscow State Academy of Choreography","","","","",0,2,0,10,2
"Mikhail Moiseev","Russia","",1882,"male","","","","","Merited Artist of the RSFSR; Order of the Badge of Honour; Stalin Prize; Meritorious Artist of the Lithuanian SSR",4,1,0,0,0
"Mikhail Mordkin","Russia","",1880,"male","Moscow State Academy of Choreography","","Tanaquil Le Clercq; Ilya Arbatov","Tanaquil Le Clercq; Ilya Arbatov","",0,1,2,0,1
"Mikhail Petrovich Murashko","Russia","",1941,"male","","","","","Honored art worker of the Russian Soviet Federative Socialist Republic; Q31818626",2,1,0,0,0
"Mikiko Matsuyama","Japan","",1939,"female","Tokyo College of Music","","","","Medal with Purple Ribbon; Order of the Precious Crown, 4th Class",2,1,0,0,1
"Mira Koltsova","Russia","Berezka Ensemble",1938,"female","Russian Institute of Theatre Arts; Moscow State Academy of Choreography","","","","Merited Artist of the RSFSR; People's Artist of the RSFSR; People's Artist of the USSR; Medal ""Veteran of Labour""; People's Artist of Ukraine; Jubilee Medal ""In Commemoration of the 100th Anniversary of the Birth of Vladimir Ilyich Lenin""; Friendship Medal; People's Artist of the Republic of North Ossetia-Alania; Order ""For Merit to the Fatherland"", 4th class; Order ""For Merit to the Fatherland"", 3rd class",10,1,0,1,2
"Miranda Weese","","",NA,"female","","","","","",0,0,0,0,0
"Miroslav Strejček","","",1942,"male","","","","","",0,0,0,0,0
"Miroslava Pešíková","Czech Republic","",1946,"female","","","","","Národní umělec",1,1,0,0,0
"Miteki Kudo","","Paris Opera Ballet",1970,"female","Paris Opera Ballet School","","","","",0,0,0,1,1
"Mizoshita Shirō","Japan","K-ballet; Tokyo Ballet; Q97311145",1949,"male","","","","","",0,1,0,3,0
"Monica Mengarelli","Sweden","",1959,"female","","","","","",0,1,0,0,0
"Monique Janotta","France","",1945,"female","","","","","",0,1,0,0,0
"Morihiro Iwata","Japan","",1970,"male","Nihon University High School","","","","Order of Friendship",1,1,0,0,1
"Mukarram Turgunbaeva","Russia","Navoi Theater; Bahor",1913,"female","","","Q20534000","Q20534000","Order of Lenin; People's Artist of the USSR; Order of the Red Banner of Labour; USSR State Prize; Order of Outstanding Merit; Order of the Badge of Honour; Medal ""For Valiant Labour in the Great Patriotic War 1941–1945""; Stalin Prize; Medal ""For Labour Valour""; Medal ""For Distinguished Labour""; People's Artist of the Uzbek SSR; State Prize of the Uzbek SSR Named After Hamza; Stalin Prize, 2nd degree; Stalin Prize, 3rd degree",14,1,1,2,0
"Munetaka Iida","Japan","Tokyo Ballet",1957,"male","","","","","",0,1,0,1,0
"Mykola Kanevets","","",NA,"male","","","","","",0,0,0,0,0
"Naďa Hajdašová","Austria; Czech Republic","",1914,"female","","","","","",0,2,0,0,0
"Nacho Duato","Spain","",1957,"male","","","","","Gold Medal of Merit in the Fine Arts; National Dance Award; Chevalier des Arts et des Lettres; Alcalá City Awards",4,1,0,0,0
"Naděžda Sobotková","Czech Republic","",1923,"female","","","","","",0,1,0,0,0
"Nadezhda Pavlova","Russia; Japan","",1905,"female","","","Aiko Ōtaki","Aiko Ōtaki","Q18701032",1,2,1,0,0
"Nadezhda Pavlova","Russia","Russian Institute of Theatre Arts",1956,"female","Russian Institute of Theatre Arts; Perm ballet school","","","","Merited Artist of the RSFSR; People's Artist of the RSFSR; People's Artist of the USSR; Order of the Badge of Honour; Lenin Komsomol Prize",5,1,0,1,2
"Naoya Kojima","Japan","",1971,"male","","","Chiharu Kiyotaki","Chiharu Kiyotaki","Varna International Ballet Competition",1,1,1,0,0
"Natalia Conus","Russia","Russian Institute of Theatre Arts",1914,"female","Russian Institute of Theatre Arts","Rostislav Zakharov","","Rostislav Zakharov","Merited Artist of the RSFSR",1,1,1,1,1
"Natalia Makarova","United States of America; Russia","Mariinsky Theatre",1940,"female","Vaganova Academy of Russian Ballet","Sulamith Messerer","","Sulamith Messerer","Merited Artist of the RSFSR; Tony Award for Best Actress in a Musical; Kennedy Center Honors; Drama Desk Award for Outstanding Actress in a Musical; Laurence Olivier Award for Best Actress in a Musical; Theatre World Special Award",6,2,1,1,1
"Natalia Mikhailovna Skorulskaya","Russia","National Opera of Ukraine",1915,"female","","","","","",0,1,0,1,0
"Natalia Tagliori","Russia","",1877,"female","Saint Petersburg Conservatory","Enrico Cecchetti; Evgenia Pavlovna Sokolova","Klavdiya Shulzhenko; Natalia Dudinskaya; Irina Bugrimova; Q15066118; Nina Peltser","Enrico Cecchetti; Evgenia Pavlovna Sokolova; Klavdiya Shulzhenko; Natalia Dudinskaya; Irina Bugrimova; Q15066118; Nina Peltser","",0,1,7,0,1
"Natalia Trukhanova","France; Russia","",1885,"female","","","","","",0,2,0,0,0
"Natalya Ryzhenko","Russia","",1938,"female","","","","","Merited Artist of the RSFSR; Merited Artist of the Russian Federation",2,1,0,0,0
"Nicolas Beriosoff","Switzerland; Russia","",1906,"male","","","","","",0,2,0,0,0
"Nicolini","","",1750,"male","","","","","",0,0,0,0,0
"Nikita Dolgushin","Russia","Novosibirsk Opera and Ballet Theatre",1938,"male","Vaganova Academy of Russian Ballet","","Alla Rubina","Alla Rubina","Merited Artist of the RSFSR; People's Artist of the RSFSR; People's Artist of the USSR",3,1,1,1,1
"Nikolai Legat","Russia","Vaganova Academy of Russian Ballet",1869,"male","Vaganova Academy of Russian Ballet","","","","",0,1,0,1,1
"Nikolai Yavorsky","Cuba; Russia","",1891,"male","Сергієвське артилерійське училище","","","","",0,2,0,0,1
"Nikolay Boyarchikov","Russia","Saint Petersburg Conservatory",1935,"male","Vaganova Academy of Russian Ballet","","","","People's Artist of the RSFSR; Order of Friendship; Order of Honour; Honored art worker of the Russian Soviet Federative Socialist Republic",4,1,0,1,1
"Nikolay Zubkovsky","Russia","",1911,"male","","","","","Merited Artist of the RSFSR; Order of the Badge of Honour; Stalin Prize",3,1,0,0,0
"Nina Aleksandrovna Anisimova","Russia","Saint Petersburg Conservatory",1909,"female","","","","","Order of the Badge of Honour; Stalin Prize; Honored art worker of the Russian Soviet Federative Socialist Republic",3,1,0,1,0
"Nina Belikova","Russia","Vaganova Academy of Russian Ballet",1913,"female","Vaganova Academy of Russian Ballet","","Ludmila Semenyaka; Aysulu Tokombayeva","Ludmila Semenyaka; Aysulu Tokombayeva","",0,1,2,1,1
"Nina Menovshchikova","Russia","",1934,"female","","","","","Merited Artist of the RSFSR; People's Artist of the RSFSR; People's Artist of the USSR",3,1,0,0,0
"Nina Nikanorova","Venezuela; Russia","",1923,"female","","","","","",0,2,0,0,0
"Nina Novak","Poland","",1923,"female","","","","","Commander of the Order of Polonia Restituta",1,1,0,0,0
"Nina Popova","United States of America; Russia","",1922,"female","","","","","",0,2,0,0,0
"Ninette de Valois","Ireland; United Kingdom","",1898,"female","","","","","Laurence Olivier Award; Order of Merit; Erasmus Prize; Albert Medal; Critics' Circle Award for Distinguished Service to the Arts; Queen Elizabeth II Coronation Award; Society of London Theatre Special Award; Knight of the Legion of Honour; Dame Commander of the Order of the British Empire; Companion of Honour",10,2,0,0,0
"Nini Theilade","Denmark","",1915,"female","","","","","",0,1,0,0,0
"Nino Ramishvili","Georgia; Russia","",1910,"female","","","","","Order of Lenin; Hero of Socialist Labour; People's Artist of the USSR; Order of the Red Banner of Labour; Order of the Badge of Honour; Medal ""For Valiant Labour in the Great Patriotic War 1941–1945""; Stalin Prize; People's artist of the Georgian SSR; Order of Honour",9,2,0,0,0
"Noëlla Pontois","France","Paris Opera",1943,"female","Paris Opera","","","","Knight of the Legion of Honour; Knight of the National Order of Merit",2,1,0,1,1
"Noriko Itō","","",1966,"female","","Momoko Tani","","Momoko Tani","",0,0,1,0,0
"Noy Avaliani","Russia","Bolshoi Theatre",1922,"male","Russian Institute of Theatre Arts","","","","",0,1,0,1,1
"Oldrich Stodola","Czech Republic","",1922,"male","","","","","",0,1,0,0,0
"Oleg Korzenkov","","Bolshoi Theatre of Belarus",1967,"male","","","","","",0,0,0,1,0
"Oleg Vinogradov","Russia","Mikhaylovsky Theatre",1937,"male","Vaganova Academy of Russian Ballet; Russian Institute of Theatre Arts","","","","People's Artist of the RSFSR; Order of Lenin; People's Artist of the USSR; Order of Friendship of Peoples; Ordre des Arts et des Lettres; Glinka State Prize of the RSFSR; State Prize of the Russian Federation; Lenin Komsomol Prize; Chevalier des Arts et des Lettres",9,1,0,1,2
"Olga Iordan","Russia","",1907,"female","Vaganova Academy of Russian Ballet","","","","Merited Artist of the RSFSR",1,1,0,0,1
"Olga Nekrasova","Russia","",1868,"female","","","","","Hero of Labour",1,1,0,0,0
"Olga Pásková","Czech Republic","",1923,"female","","","","","",0,1,0,0,0
